;Unnamed: 0.1;Unnamed: 0;name;surname;gender;birthDate;birthPlace;birthCountry;job;tags
2;2;1448;Cezary;Żurek;M;1987-08-07;Grudziądz;Polska;Jest kluczowym specjalistą w dziedzinie przepływu towarów, odpowiedzialnym za optymalizację procesów. Zajmuje się zarządzaniem magazynami i transportem.;['transport']
8;8;3698;Jacek;Nowak;M;1991-11-23;Grudziądz;Polska;Kluczowy gracz w świecie, gdzie towary muszą docierać do celu szybko i sprawnie. Odpowiada za wybór najlepszych metod transportu, negocjacje z przewoźnikami i zarządzanie dokumentacją.;['transport']
11;11;6577;Oskar;Sieradzki;M;1993-12-18;Grudziądz;Polska;Osoba ta jest odpowiedzialna za to, aby materiały trafiały tam, gdzie są potrzebne, w odpowiednim czasie i ilości. Analizuje potrzeby i projektuje najlepsze rozwiązania.;['transport']
19;19;8953;Wojciech;Bielik;M;1986-06-24;Grudziądz;Polska;Zajmuje się kompleksowym zarządzaniem ruchem towarowym, od planowania po realizację. To on decyduje, gdzie trafiają poszczególne towary. Jego celem jest zapewnienie maksymalnej efektywności i minimalizacji kosztów.;['transport']
25;25;11140;Wacław;Jasiński;M;1986-03-01;Grudziądz;Polska;Ta osoba jest mózgiem operacji związanych z przepływem towarów. Jej zadaniem jest zapewnienie, że wszystkie elementy systemu działają spójnie.;['transport']
